{
  "schemaVersion": 1,
  "status": "approved",
  "purpose": "production",
  "reviewer": "game_ga_full direct visual self review; independent acceptance pending",
  "reviewedAt": "2026-10-25T06:22:53.083Z",
  "binding": {
    "assetId": "thumbnail:ga-1180Y:front",
    "fullId": "ga-1180Y",
    "side": "front",
    "path": "src/game/art/thumbnails/ga-1180Y/front.webp",
    "sha256": "4f69ff4dd5a28ec783bc61b6bf052ef911eb9ad9f9b39056e70b0b94d11defa5",
    "masterPath": "docs/design/game-reviews/masters/character/ga-1180Y/front.png",
    "masterSha256": "879abb4e42b3ef265b4801f0796aefa000331bf0016ef8b1e28907dfd069b700",
    "reference": "docs/design/game-reference/cards.png"
  },
  "referenceSha256": "74866ae9b5b4fdebe715994ae3a836ec9636be3a6ab69e44e740e8493dbb99e0",
  "generation": {
    "method": "derived-export",
    "sourceEvidence": "docs/design/game-reviews/ga/ga-1180Y-front-export.json",
    "sourceEvidenceSha256": "6051dd9fe0159974a48436ae3b5bc01dcb0189e476d14180d610021e98187969"
  },
  "checks": {
    "face": {
      "result": "pass",
      "observation": "1180Y: strongest structural broad stocky silhouette, round silver cap with tall flat central metal reinforcing ridge, low calm black eyes and short asymmetric smile. Thick plum coating armor with dense small pale silver flecks, FOUR layered shoulder lames per side, broad riveted collar and belt bands, X diagonal breastplate straps AROUND hexagonal horizontal-band emblem, layered flared hip tassets, large polygon knee guards and broad rounded riveted boots Direct original/master/runtime comparison preserves this grade's facial expression and cap profile.",
      "evidence": "src/game/art/thumbnails/ga-1180Y/front.webp",
      "sha256": "4f69ff4dd5a28ec783bc61b6bf052ef911eb9ad9f9b39056e70b0b94d11defa5",
      "displayWidth": null
    },
    "silhouette": {
      "result": "pass",
      "observation": "1180Y: strongest structural broad stocky silhouette, round silver cap with tall flat central metal reinforcing ridge, low calm black eyes and short asymmetric smile. Thick plum coating armor with dense small pale silver flecks, FOUR layered shoulder lames per side, broad riveted collar and belt bands, X diagonal breastplate straps AROUND hexagonal horizontal-band emblem, layered flared hip tassets, large polygon knee guards and broad rounded riveted boots. Arms slightly behind hips, firm open stance. Same friendly GA family, no weapon or cape or glow, frame will be metadata elsewhere. Full head, hands and boots remain inside transparent margins in direct comparison.",
      "evidence": "src/game/art/thumbnails/ga-1180Y/front.webp",
      "sha256": "4f69ff4dd5a28ec783bc61b6bf052ef911eb9ad9f9b39056e70b0b94d11defa5",
      "displayWidth": null
    },
    "emblem": {
      "result": "pass",
      "observation": "Clear six-sided metal chest badge with silver upper/lower fields and a straight dark horizontal band; no CR roller or PO droplet substitution. Directly inspected original, master and runtime.",
      "evidence": "src/game/art/thumbnails/ga-1180Y/front.webp",
      "sha256": "4f69ff4dd5a28ec783bc61b6bf052ef911eb9ad9f9b39056e70b0b94d11defa5",
      "displayWidth": null
    },
    "material": {
      "result": "pass",
      "observation": "Original grade-specific coating and construction are retained in newly generated tactile metal: 1180Y: strongest structural broad stocky silhouette, round silver cap with tall flat central metal reinforcing ridge, low calm black eyes and short asymmetric smile. Thick plum coating armor with dense small pale silver flecks, FOUR layered shoulder lames per side, broad riveted collar and belt bands, X diagonal breastplate straps AROUND hexagonal horizontal-band emblem, layered flared hip tassets, large polygon knee guards and broad rounded riveted boots. Arms slightly behind hips, firm open stance. Same friendly GA family, no weapon or cape or glow, frame will be metadata elsewhere.",
      "evidence": "src/game/art/thumbnails/ga-1180Y/front.webp",
      "sha256": "4f69ff4dd5a28ec783bc61b6bf052ef911eb9ad9f9b39056e70b0b94d11defa5",
      "displayWidth": null
    },
    "thumbnail72": {
      "result": "pass",
      "observation": "Directly viewed actual 72x108 thumbnail raster in ga-1180Y-comparison.png and whole-family sheet. Face, plum silhouette and hexagon/band remain distinguishable; full figure uncropped, no baked text.",
      "evidence": "docs/design/game-reviews/ga/ga-1180Y-front-72.png",
      "sha256": "0d8cb3ae49863b235d93c88c6b8fe31f4429a66cb51b7898aacb78ba2b10b26a",
      "displayWidth": 72
    }
  },
  "metadata": {
    "face": null,
    "crop": null
  }
}
