{
  "schemaVersion": 1,
  "status": "approved",
  "purpose": "production",
  "reviewer": "game_poo_full direct visual self review; independent acceptance pending",
  "reviewedAt": "2026-10-25T05:30:16.505Z",
  "binding": {
    "assetId": "character:poo-270D:front",
    "fullId": "poo-270D",
    "side": "front",
    "path": "src/game/art/characters/poo-270D/front.webp",
    "sha256": "17d17f2341ebc08acf4e703607e48134c339cc9ae007bc1194a82bb2ef2dcc74",
    "masterPath": "docs/design/game-reviews/masters/character/poo-270D/front.png",
    "masterSha256": "6457d45d35123b49769e4f769b2efbbd915e9778dfa9f50bf7fc892b2487eea4",
    "reference": "docs/design/game-reference/cards.png"
  },
  "referenceSha256": "74866ae9b5b4fdebe715994ae3a836ec9636be3a6ab69e44e740e8493dbb99e0",
  "generation": {
    "method": "built-in-imagegen",
    "sourceEvidence": "docs/design/game-reviews/poo/poo-270D-front-generation.json",
    "sourceEvidenceSha256": "2e8852301b472fc38cda7cdc27a4d3574866b8549dd51a200df335cb0cb8e043"
  },
  "checks": {
    "face": {
      "result": "pass",
      "observation": "Silver smooth curved flame tip, low half-lidded eyes and short horizontal mouth retain PO family identity; brushed rounded rectangular face remains unobscured.",
      "evidence": "src/game/art/characters/poo-270D/front.webp",
      "sha256": "17d17f2341ebc08acf4e703607e48134c339cc9ae007bc1194a82bb2ef2dcc74",
      "displayWidth": null
    },
    "silhouette": {
      "result": "pass",
      "observation": "Short red DQ vest has two pale lapels, one open palm and rounded silver boots; full tip and both soles fit inside transparent margins.",
      "evidence": "src/game/art/characters/poo-270D/front.webp",
      "sha256": "17d17f2341ebc08acf4e703607e48134c339cc9ae007bc1194a82bb2ef2dcc74",
      "displayWidth": null
    },
    "emblem": {
      "result": "pass",
      "observation": "Circular chest badge is vertically divided dark cracked scale / polished silver with a central silver droplet, with no GA hexagon or CR rolls.",
      "evidence": "src/game/art/characters/poo-270D/front.webp",
      "sha256": "17d17f2341ebc08acf4e703607e48134c339cc9ae007bc1194a82bb2ef2dcc74",
      "displayWidth": null
    },
    "material": {
      "result": "pass",
      "observation": "Thin folded pale lapels and smooth rounded limbs retain drawing-quality formability; scale/pickled-silver contrast remains visible without numeric strength or combat claims.",
      "evidence": "src/game/art/characters/poo-270D/front.webp",
      "sha256": "17d17f2341ebc08acf4e703607e48134c339cc9ae007bc1194a82bb2ef2dcc74",
      "displayWidth": null
    },
    "thumbnail72": {
      "result": "pass",
      "observation": "Actual 72px raster retains single-flame head, red short vest, two pale lapels, asymmetric open hand and circular contrast badge; no baked text or crop.",
      "evidence": "docs/design/game-reviews/poo/poo-270D-front-72.png",
      "sha256": "2cce00cb8c8ff1f5b8db7e7b5968d5c6d2a7637b648d6314f4516b11c0416030",
      "displayWidth": 72
    }
  },
  "metadata": {
    "face": "846cb6a8e6edf49f40d46af31ae55f80e66e670a989dacc628903d94b80bca13",
    "crop": null
  }
}
